{
  "schema_version": 1,
  "project": "Gatilab Blog Rankings",
  "edition": "2026-09",
  "status": "final",
  "generated_at": "2026-08-21T12:00:00Z",
  "category": {
    "slug": "food",
    "name": "Food",
    "description": "Recipes, culinary technique, restaurant culture, food history, and food science."
  },
  "tracks": {
    "independent": {
      "slug": "independent",
      "label": "Independent Blogs",
      "count": 100,
      "items": [
        {
          "rank": 1,
          "id": "smittenkitchen-com",
          "name": "Smitten Kitchen",
          "url": "https://smittenkitchen.com/",
          "country": "XX",
          "score": 98.0,
          "movement": "new",
          "best_for": "tested recipes and everyday cooking",
          "reason": "Smitten Kitchen concentrates on tested recipes and everyday cooking, with a discoverable feed, a visible article archive that makes its current publishing work easier to evaluate.",
          "limitation": "Its broad subject range can make depth and usefulness uneven across individual topics.",
          "confidence": "standard",
          "reviewed_at": "2026-08-21",
          "evidence_urls": [
            "https://smittenkitchen.com/",
            "https://smittenkitchen.com/comments/feed/"
          ]
        },
        {
          "rank": 2,
          "id": "pinchofyum-com",
          "name": "Pinch of Yum",
          "url": "https://pinchofyum.com/",
          "country": "XX",
          "score": 97.0,
          "movement": "new",
          "best_for": "health-aware recipes and practical cooking",
          "reason": "Pinch of Yum concentrates on health-aware recipes and practical cooking, with a visible article archive, clear ownership context that makes its current publishing work easier to evaluate.",
          "limitation": "Publishing cadence is harder to verify because the site does not expose a discoverable RSS or Atom feed.",
          "confidence": "standard",
          "reviewed_at": "2026-08-21",
          "evidence_urls": [
            "https://pinchofyum.com/",
            "https://pinchofyum.com/about"
          ]
        },
        {
          "rank": 3,
          "id": "recipetineats-com",
          "name": "RecipeTin Eats",
          "url": "https://recipetineats.com/",
          "country": "XX",
          "score": 96.0,
          "movement": "new",
          "best_for": "tested recipes and everyday cooking",
          "reason": "RecipeTin Eats concentrates on tested recipes and everyday cooking, with a discoverable feed that makes its current publishing work easier to evaluate.",
          "limitation": "Its broad subject range can make depth and usefulness uneven across individual topics.",
          "confidence": "standard",
          "reviewed_at": "2026-08-21",
          "evidence_urls": [
            "https://recipetineats.com/",
            "https://www.recipetineats.com/comments/feed/",
            "https://www.recipetineats.com/nagi-recipetin-eats/"
          ]
        },
        {
          "rank": 4,
          "id": "cookieandkate-com",
          "name": "Cookie and Kate",
          "url": "https://cookieandkate.com/",
          "country": "XX",
          "score": 95.0,
          "movement": "new",
          "best_for": "health-aware recipes and practical cooking",
          "reason": "Cookie and Kate concentrates on health-aware recipes and practical cooking, with a discoverable feed, a visible article archive that makes its current publishing work easier to evaluate.",
          "limitation": "Its broad subject range can make depth and usefulness uneven across individual topics.",
          "confidence": "standard",
          "reviewed_at": "2026-08-21",
          "evidence_urls": [
            "https://cookieandkate.com/",
            "https://cookieandkate.com/comments/feed/"
          ]
        },
        {
          "rank": 5,
          "id": "skinnytaste-com",
          "name": "Skinnytaste",
          "url": "https://skinnytaste.com/",
          "country": "XX",
          "score": 94.0,
          "movement": "new",
          "best_for": "health-aware recipes and practical cooking",
          "reason": "Skinnytaste concentrates on health-aware recipes and practical cooking, with a clearly defined editorial focus that makes its current publishing work easier to evaluate.",
          "limitation": "Publishing cadence is harder to verify because the site does not expose a discoverable RSS or Atom feed.",
          "confidence": "standard",
          "reviewed_at": "2026-08-21",
          "evidence_urls": [
            "https://skinnytaste.com/"
          ]
        },
        {
          "rank": 6,
          "id": "ohsheglows-com",
          "name": "Oh She Glows",
          "url": "https://ohsheglows.com/",
          "country": "XX",
          "score": 93.0,
          "movement": "new",
          "best_for": "recipes, technique, and food culture",
          "reason": "Oh She Glows concentrates on recipes, technique, and food culture, with a clearly defined editorial focus that makes its current publishing work easier to evaluate.",
          "limitation": "Publishing cadence is harder to verify because the site does not expose a discoverable RSS or Atom feed.",
          "confidence": "standard",
          "reviewed_at": "2026-08-21",
          "evidence_urls": [
            "https://ohsheglows.com/"
          ]
        },
        {
          "rank": 7,
          "id": "mynewroots-org",
          "name": "My New Roots",
          "url": "https://mynewroots.org/",
          "country": "XX",
          "score": 92.0,
          "movement": "new",
          "best_for": "health-aware recipes and practical cooking",
          "reason": "My New Roots concentrates on health-aware recipes and practical cooking, with a discoverable feed, clear ownership context that makes its current publishing work easier to evaluate.",
          "limitation": "Its broad subject range can make depth and usefulness uneven across individual topics.",
          "confidence": "standard",
          "reviewed_at": "2026-08-21",
          "evidence_urls": [
            "https://mynewroots.org/",
            "https://www.mynewroots.org/comments/feed/",
            "https://www.mynewroots.org/about/"
          ]
        },
        {
          "rank": 8,
          "id": "jocooks-com",
          "name": "Jo Cooks",
          "url": "https://jocooks.com/",
          "country": "XX",
          "score": 91.0,
          "movement": "new",
          "best_for": "tested recipes and everyday cooking",
          "reason": "Jo Cooks concentrates on tested recipes and everyday cooking, with a discoverable feed, a visible article archive that makes its current publishing work easier to evaluate.",
          "limitation": "Its broad subject range can make depth and usefulness uneven across individual topics.",
          "confidence": "standard",
          "reviewed_at": "2026-08-21",
          "evidence_urls": [
            "https://jocooks.com/",
            "https://www.jocooks.com/web-stories/feed/",
            "https://www.jocooks.com/about/"
          ]
        },
        {
          "rank": 9,
          "id": "carlsbadcravings-com",
          "name": "Carlsbad Cravings",
          "url": "https://carlsbadcravings.com/",
          "country": "XX",
          "score": 90.0,
          "movement": "new",
          "best_for": "health-aware recipes and practical cooking",
          "reason": "Carlsbad Cravings concentrates on health-aware recipes and practical cooking, with a discoverable feed, a visible article archive that makes its current publishing work easier to evaluate.",
          "limitation": "Authorship and editorial-policy information is less visible than on higher-ranked publications.",
          "confidence": "standard",
          "reviewed_at": "2026-08-21",
          "evidence_urls": [
            "https://carlsbadcravings.com/",
            "https://carlsbadcravings.com/comments/feed/",
            "https://carlsbadcravings.com/about/"
          ]
        },
        {
          "rank": 10,
          "id": "minimalistbaker-com",
          "name": "Minimalist Baker",
          "url": "https://minimalistbaker.com/",
          "country": "XX",
          "score": 89.0,
          "movement": "new",
          "best_for": "baking, pastry, and dependable technique",
          "reason": "Minimalist Baker concentrates on baking, pastry, and dependable technique, with a discoverable feed, a visible article archive that makes its current publishing work easier to evaluate.",
          "limitation": "Its broad subject range can make depth and usefulness uneven across individual topics.",
          "confidence": "standard",
          "reviewed_at": "2026-08-21",
          "evidence_urls": [
            "https://minimalistbaker.com/",
            "https://minimalistbaker.com/comments/feed/",
            "https://minimalistbaker.com/about/"
          ]
        }
      ]
    },
    "publisher_company": {
      "slug": "publisher_company",
      "label": "Publisher and Company Blogs",
      "count": 100,
      "items": [
        {
          "rank": 1,
          "id": "seriouseats-com",
          "name": "Serious Eats",
          "url": "https://seriouseats.com/",
          "country": "XX",
          "score": 98.0,
          "movement": "new",
          "best_for": "baking, pastry, and dependable technique",
          "reason": "Serious Eats concentrates on baking, pastry, and dependable technique, with a discoverable feed, a visible article archive that makes its current publishing work easier to evaluate.",
          "limitation": "Its broad subject range can make depth and usefulness uneven across individual topics.",
          "confidence": "standard",
          "reviewed_at": "2026-08-21",
          "evidence_urls": [
            "https://seriouseats.com/",
            "https://feeds-api.dotdashmeredith.com/v1/rss/google/ad57d421-0ff5-41e7-a5da-f2167b6d7f7a",